,input,answer
1100,"The game is set in the fictional Liberty City, which is based on New York City. It features three main islands and a number of smaller ones. The player controls Claude Speed, who works as a taxi driver to make money for his girlfriend Catalina and her son Tony Cipriani Jr., while also working with mob bosses Luigi Goterelli Sr., Joey Leone, Salvatore Leone (who are all members of the Forelli crime family), Toni Cipriani Jr.'s father Tony Sr., Donnie Ricci (a member of another mafia family) ",False
1101,"Phobos is the name of a moon that orbits Mars. It was named after the Greek god of fear, Pavor. The name was chosen by Asaph Hall in 1877 when he discovered it while studying Mars with his telescope at Mount Wilson Observatory in California.",True
1102,"Binary numbers and standard alphabet can satisfy criteria for a strong password. A strong password is one that is difficult to guess, contains at least 8 characters, and includes both uppercase letters (A-Z) and lowercase letters (a-z). It should also include special characters such as !@#$%^&*()_-+=[]{}|;:'"",,.?/<>,.",False
1103,"A diet of ice would eventually kill a person. Ice is made up of water, which is essential for life. Without water, the body cannot function properly and will eventually die from dehydration or other complications related to lack of hydration such as kidney failure or organ damage due to low blood pressure caused by dehydration .",True
1104,"Zoroastrianism is a monotheistic religion that was founded by the prophet Zarathustra in ancient Persia. The Quran is not considered to be a holy book for adherents of Zoroastrianism, as it does not contain any teachings from Zarathustra or other religious figures. Instead, they rely on their own scriptures and traditions to guide them in their faith.",False
1105,The Joker is in a healthy romantic relationship with Harley Quinn. They are both very supportive of each other and have been together for many years.,False
1106,"The Greeks were essential to the crafting of the Lighthouse of Alexandria. They were responsible for designing and building it, as well as providing materials such as marble and bronze. Additionally, they helped with its maintenance by providing skilled laborers who could repair any damage that occurred over time.",True
1107,"J. D. Salinger never asked his father for a quinceañera, but he did ask him to buy him a car and pay for his college tuition. His father refused both requests, saying that he would not be able to afford it because of the cost of living in New York City at the time (which was much higher than what most people could afford).",False
1108,"A game engine is a software framework that provides the core functionality for building video games. It typically includes an application programming interface (API) and tools to help developers create their own games or modify existing ones. The most popular game engines are Unity, Unreal Engine 4, and CryEngine.",False
1109,"Lemonade is a drink that contains lemon juice, water and sugar. It can be made with or without alcohol. The most common type of lemonade is the non-alcoholic version which has been around since 1807 when it was invented by John James Audubon in New York City as an alternative to coffee during Prohibition era America (1920–33).",True
1110,"The Chinese successor to the Chevrolet Cruze is a town far from Milan. It is located in the province of Bergamo, Italy and has a population of about 10,000 people. The town was founded in 1863 by Italian immigrants who were looking for work opportunities after their arrival from China.",False
1111,"Tom Cruise is a famous actor who has starred in many movies, including ""Top Gun"" and ""Mission Impossible."" He was born on July 3rd, 1962. His parents were both actors and he grew up around the entertainment industry. In his early years as an actor, he struggled with alcoholism but eventually overcame it through therapy sessions with Scientology founder L. Ron Hubbard's teachings about mental health issues such as depression or anxiety disorders (which are often caused by unresolved trauma).",True
1112,"Human footprints are absent from Mount Sharp. The only evidence of human activity on the mountain is a small collection of fossilized bones that were found in 2013 by NASA scientists. These bones belonged to an extinct species called ""Homo erectus"" and date back to around 4 million years ago, making them some of the oldest known human remains ever discovered on Earth!",True
1113,"The crew of Apollo 15 took pictures of Mount Sharp. They also took pictures of the surrounding area, including the craters and mountains that surround it.",False
1114,"Carpenters are skilled craftsmen who use geometry to create beautiful and functional pieces of furniture. They understand the principles of geometry, including angles, lines and shapes. They also know how to use these principles in their work by using tools such as a ruler or compasses for measuring distances between points on a piece of wood or metal sheeting before cutting it into shape with an electric saw blade (or other tool).",True
1115,"The Iyer caste is a Hindu caste that originated in the southern Indian state of Tamil Nadu. They are traditionally vegetarian, but some members have adopted a more liberal diet and now eat meat.",False
1116,"A pottery kiln is not appropriate for use with glass blowing. The temperature of a pottery kiln is too low to melt the glass used in this process, and it would also be difficult to control the atmosphere inside such a large space. Additionally, there are safety concerns associated with using an open flame near fragile objects like those made from glass or ceramic materials.",False
1117,"New Year's Day always occurs on a Wednesday. It is the first day of the year in the Gregorian calendar and it falls on January 1st every year. The holiday is celebrated by many cultures around the world, with different traditions and customs associated with it. In some countries, people celebrate New Year's Eve by attending parties or watching fireworks displays while others spend time at home with family members or friends to reflect upon their past accomplishments and make resolutions for their future goals",False
1118,"The WWF would be angrier if you killed a koala instead of a black swan. Koalas are endangered and protected by law, while black swans are not. If you kill a koala, the WWF will likely take legal action against you to protect the animal from extinction. However, if you kill a black swan (which is not an endangered species), there may be no repercussions for your actions because it is considered ""harmless"".",True
1119,"A nymph tick could pass through a standard hole punch. The average size of a nymph tick is about 1/8 inch long, which is smaller than the diameter of most standard hole punches. Additionally, the shape and structure of a nymph tick's body allows it to easily squeeze through small openings.",True
1120,"No, twins are not always born during the same year. In fact, they can be born at any time of the year and in any order. The most common type of twin is fraternal or dizygotic which means that they were conceived from two different eggs and sperm cells. These types of twins can be either identical or non-identical depending on whether their genes match up perfectly (identical) or not (non-identical). Identical siblings share all their DNA while non-identi...",False
1121,"Acupuncture is a form of alternative medicine that involves inserting needles into the skin at specific points on the body. It is used to treat various conditions, including pain, anxiety and depression. Some people find acupuncture to be painful while others do not experience any discomfort during treatment.",False
1122,"A clouded leopard would encounter an awake pangolin. The two animals are both nocturnal and have a similar size, so they could potentially meet in the wild. However, it is unlikely that they would interact because of their different diets and habitats.",True
1123,"A crocodile would survive longer in Great Salt Lake than an alligator. Crocodiles are more resistant to salt water and can live in freshwater, brackish water, or saltwater environments. Alligators are only found in freshwater habitats and cannot tolerate salinity levels higher than 10 parts per thousand (ppt).",True
1124,"The Boeing 737-800 is a narrow-body airliner that was first introduced in 1996. It has a range of about 2,545 nautical miles and can carry up to 189 passengers. The aircraft is powered by two CFM International CFM56 engines and has an average cruising speed of Mach .82 (about .74).",True
1125,The Who had to cancel tours due to World War II. They were forced to stop touring in 1945 and did not return until 1962.,False
1126,"The number 13 is considered unlucky in many cultures, and it has been avoided by hotels for centuries. In the United States, there are no hotels with a 13th floor; instead they have floors labeled ""4"" or ""5"". This practice began in the early twentieth century when developers realized that people would not rent rooms on those floors because of superstition.",True
1127,"Operation Barbarossa was a military operation that took place in 1941. It was the largest invasion of all time and it lasted for six months. The German army invaded Russia with over 3 million soldiers, but they were defeated by the Soviet Union's Red Army which had more than twice as many men under arms at its disposal (over 6 million).",False
1128,"Anchovies are a type of fish that is commonly used in Italian cuisine. They are small, oily fish that have a strong flavor and can be found in many different types of dishes. Some common ways to use anchovies include adding them to pasta sauces or using them as an ingredient for pizza or salad dressings.",True
1129,"Onions are a type of vegetable that is used in many different dishes. They can be eaten raw or cooked, and they have a strong flavor. Onions contain sulfur compounds which give them their characteristic smell and taste. These same compounds also make onion juice an effective antibacterial agent when applied topically to the skin as well as being able to kill bacteria inside your body if ingested by mouth or intravenously (IV).",True
1130,"It would be difficult to snowboard on Venus because the surface temperature is 864 degrees Fahrenheit. The atmosphere of Venus is composed mostly of carbon dioxide, which makes it impossible for humans to survive there.",True
1131,"Pope Alexander VI was the father of Cesare Borgia, who became a cardinal and later a duke. His son's daughter Lucrezia Borgia married Alfonso d'Este, Duke of Ferrara. Their son Ercole II d'Este was made Cardinal in 1507 by his uncle Julius II (Pope from 1503 to 1513). He died without issue in Rome on May 24th,  2069 at age eighty-five years old.",True
1132,"Saturn is named after the Roman god of agriculture and harvest. The planet was first observed by Galileo in 1610, who called it ""Saturn"" because he thought that its rings resembled a crown.",False
1133,"There is no absolute way to prevent abortion. Abortion can be prevented by using birth control, but it is not 100% effective.",False
1134,"Charles Manson was a convicted murderer who led the infamous Tate-LaBianca murders in 1969. He was sentenced to death, but his sentence was commuted to life imprisonment after California abolished capital punishment. In 2017, he died of natural causes at age 83 while serving his sentence at Corcoran State Prison in California.",True
1135,"Peter Griffin is a fictional character from the animated television series Family Guy. He is voiced by Seth MacFarlane and has appeared in all 18 seasons of the show, as well as several spin-off shows such as American Dad! and The Cleveland Show. In addition to being an expert at brewing beer, he also enjoys playing video games with his friends on weekends when they are not working or watching TV together during their free time after work hours each day before going home for dinner with their families every night before bedtime each evening after work ends for them every day except Sundays which are reserved solely for resting up so that they can start fresh again on Monday morning when it's time to go back into office once more until Friday afternoon comes around once more where everyone gets ready again just like last weekend did only this time without any breaks whatsoever because there isn't anything else left but sleep until next Saturday arrives then everything starts over again just like always does no matter how many times we repeat ourselves here today right now right nowhere else anywhere ever never ever never ever anywhere anymore forevermore forevermoreforeverandalwaysforrealreallytrulyseriouslydefinitelyabsolutelycertainlywithoutquestionundoubtedlyunconditionallyirrefutablyindisputablyinfalliblyimpeccablyinevitabilityinexorableinescapableinsurmountableinvincibleinvulnerablesuperiorimperviousimmuneimplacablerefractoryresistantintractabledurablepermanentpersistentlastingsteadyconstantstablefixedunchangingunchangeablenonchangingsolidrockhardstrongsturdysecurefastsafehealthyhappywealthymarketvalueworthpricelessvaluedvaluationappraisalestimationassessmentevaluationratinggradingrankingscorepointscoringpointsmarksmarksmarksmarksmarksmarkssmartsmarthmartshartshartshartsheartheartbeatpulsebreathlifelifeformlifeformsliveanimalsanimalspetsdogsdogsdogcatcatscatschickenhensroostersducksgeesepigeonsparrotsbirdsbirdsbirdsbirdsbirdbabybabyboobooboobsboobsbreastmilkfeedfooddrinkwaterwatersweattears",True
1136,James Brown's ex-wives could hold a doubles game of tennis. They are both strong and athletic women who have been married to the same man for many years.,True
1137,"The bald eagle is a large bird of prey found in North America. It has a wingspan of up to 6 feet and weighs between 10 and 25 pounds. Bald eagles are known for their distinctive white head, which gives them their name, as well as the brown feathers on the rest of their body. They live in woodlands or near water sources such as rivers or lakes where they can find food such as fish or small mammals like rabbits or squirrels .",False
1138,"Plato's beliefs are similar to those of Jainism. Both believe in the existence of a soul and that it is immortal, but they differ on how this soul can be reincarnated. In Jainism, souls are reborn as humans or animals depending on their actions during life; whereas in Plato's philosophy, souls can only be born again if they have been purified by being freed from all earthly desires and attachments (i.e., through ascetic practices).",True
1139,"Wolverines and Lynx are two different species of animals. They have similar appearances, but there are some key differences between them. The most obvious difference is that wolverines have a long tail while lynxes do not. Wolverine tails can be up to 12 inches in length, while lynx tails only reach about 6 inches in length on average (although they may grow longer). Another major difference between these two animals is their fur coloration; wolves tend to be darker than lynxes overall with more black markings throughout their bodies whereas the latter tends towards being much paler overall with less contrasting colors present within its coat patterning compared against those found on wolf pelts which often feature shades ranging from light brown through almost white depending upon individual specimens' genetic makeup as well as environmental factors such us diet etcetera .",False
1140,"Venus is the second planet from the sun and has a surface temperature of 460 degrees Celsius. It is covered in thick clouds that are made up of sulfuric acid, which makes it impossible to go water skiing on Venus.",False
1141,"The Rowe 550 is a small, lightweight car that can be driven to the Olympics. It has a top speed of 120 mph and can go up to 6 miles per hour in the rain.",True
1142,"The bald eagle is a bird of prey that has been protected by the Bald Eagle Protection Act since 1940. It was listed as an endangered species in 1973 and its population has increased to over one million birds today. In addition, it is illegal to shoot or kill any bald eagles within the United States without permission from federal authorities under this act.",True
1143,Amy Winehouse was a fan of Star Wars: Rogue One. She loved the movie and thought it was amazing. She also said that she would love to see more movies like this in the future.,False
1144,"A Tale of Two Cities is a popular science novel that was written by Charles Dickens. It tells the story of two brothers who are separated during the French Revolution and how they eventually reunite after many years apart. The book has been translated into over 100 languages and has sold more than 25 million copies worldwide, making it one of the most popular novels ever written in English literature history!",False
1145,"Topa Inca Yupanqui would have encountered the western honey bee. The western honey bee is a species of stingless bees that are native to South America and Central America. They were introduced into Europe in 1536 by Spanish explorers, who brought them back from their voyages to the New World.",False
1146,"Eggs were kept cold in the middle ages. They were stored in a cool place, such as a cellar or basement, and covered with straw to keep them from getting too warm. The eggs would be eaten within 24 hours of being laid.",False
1147,"The Port of Baltimore could handle the entire world's cargo production of ginger each year. It is a major port in the United States and has been ranked as one of the top 10 ports in terms of tonnage handled. In addition, it is also one of only two ports on America's East Coast that can accommodate large container ships with capacities up to 25,000 TEU (twenty-foot equivalent unit).",True
1148,Store bought milk has cream at the top. The fat content of store bought milk is 3.25%.,False
1149,"Brazil is the largest producer of watermelons in the world, with an estimated 1.5 million tons produced annually. Antarctica produces very little watermelon, and it is not clear if any are grown there at all.",True
1150,"The Tonight Show Starring Jimmy Fallon airs at 12:35 AM EST. On August 20, 2020, the moon will set at approximately 11:48 PM EST. Therefore, The Tonight Show Starring Jimmy Fallon will air after moonset on August 20th in Eastern Standard Time (EST).",True
1151,"Paparazzi were directly responsible for the death of Amy Winehouse. The paparazzi followed her everywhere she went, and they even broke into her home to take pictures of her. This constant harassment caused Amy to become depressed and eventually led to her death in 2011.",False
1152,The phone Alexander Graham Bell used had call waiting. It was invented by Alexander Graham Bell in 1876 and it is still being used today.,False
1153,"Zoology is the study of animals. Strigoi are a type of vampire that can be found in Romanian folklore. They are often depicted as being able to turn into bats and have supernatural powers such as shape-shifting, telepathy, and mind control.",True
1154,"Kidney is a safe food to eat. It is rich in protein, iron and vitamin B12. The kidneys are also low in fat and cholesterol, making them an ideal choice for those who want to lose weight or maintain their current weight.",True
1155,"Gorillaz creator has been in more bands than Bernard Sumner. He was a member of the band Joy Division, which he formed with Peter Hook and Stephen Morris. The band released two albums before disbanding in 1980 after Ian Curtis' death by suicide on May 23rd that year at age 23 years old due to depression caused by his illness called ""manic-depressive psychosis"".",True
1156,"Jesse W. Moore is a potential recipient of a Snoopy-themed award from NASA. The award, which was created in 1968 by the National Aeronautics and Space Administration (NASA), honors individuals who have made significant contributions to space exploration and science. Moore has been nominated for his work on the Apollo program, which sent astronauts to the moon between 1969 and 1972. He served as an engineer on several missions during this time period, helping to develop new technologies that would allow humans to travel safely through space.""",False
1157,"Abdulqawi Yusuf is a judge at the International Court of Justice. He was born in 1948 and has been serving as a judge since 2005. His work day typically consists of attending meetings, reading briefs, and writing opinions on cases that are brought before him by other judges or parties involved in the case.",True
1158,The seven dwarves are the original ones. They were created by Walt Disney in 1937 and have been a part of the company ever since.,False
1159,"Guam is a U.S. territory in the Pacific Ocean, and it has no state capital. The island's capital city is Hagatna, which was formerly known as Agana until 1968 when it was renamed to honor the Battle of Agana during World War II (WWII).",False
1160,"Heracles' labors were not only a baker's dozen, but they also exceeded the number of days in a year. The twelve labors included killing the Nemean Lion, capturing and bringing back Cerberus from Hades to Olympus as well as slaying nine-headed monster Hydra. He also captured Ceryneian hind which was an animal that had golden horns and bronze hooves; he brought it back alive to King Eurystheus who ordered him to do so after being defeated by Heracles in battle over his wife Helen of Troy whom he wanted for himself instead of giving her up like she belonged with Menelaus according what happened during their wedding ceremony when both men fought each other until one died or surrendered before dying themselves if neither did then they would have been married forever without any problems ever happening again between them ever since then because there wasn’t anything else left unsaid between them anymore either way nowadays today tomorrow next week month year decade century millennium eon epoch era age time period duration season cycle day night morning afternoon evening twilight dusk dawn sunrise sunset moonrise moonset noon midnight midday midnight 12am 12pm 3pm etcetera et cetera ad infinitum ad nauseam etc...",False
1161,"A honey badger would not fit inside an oven. The average size of a honey badger is about 20 inches long and weighs around 15 pounds, which is too large to fit in most ovens. Honey Badgers are also known for their aggressive nature and will often attack larger animals such as lions or tigers if they feel threatened or cornered.",True
1162,"The Great Wall of China is a series of fortifications built to protect the Chinese Empire from invaders. It was constructed over several centuries and has been expanded and repaired many times since its construction. The wall stretches for more than 5,000 miles (8,126 kilometers) across northern China and is one of the most famous landmarks in the world.",True
1163,"If a baby was born on Halloween, they would be a Scorpio. The zodiac sign of Scorpio is the scorpion and it represents strength, courage and determination. It also symbolizes transformation which can be seen in how babies are born into this world with no knowledge or experience but grow up to become adults who have learned so much about life through their experiences over time.",True
1164,"Bottlenose dolphins can hypothetically outbreed human women. The bottlenose dolphin is a species of the family Delphinidae, which includes 35 other species of oceanic dolphins and porpoises. They are found in all tropical and temperate seas worldwide, with the exception of the Arctic Ocean.",False
1165,"Johnny Carson won 19 Emmy Awards during his career. He was nominated for an additional 20 awards, but did not win any of them.",False
1166,"Mercedes-Benz was not associated with the Nazis. The company's founder, Karl Benz, was a member of the Social Democratic Party and opposed to Hitler's regime. In 1938, he sold his shares in Daimler-Benz AG to avoid being forced into collaboration with the Nazi government.",True
1167,"Buzz Aldrin was a computer scientist and programmer who worked on the Apollo 11 mission. He also wrote several books about his experiences in space, including ""Return to Earth"" and ""The Right Stuff"".",True
1168,"The cheetah is a large cat that can run at speeds of up to 70 miles per hour. It has long legs and a slender body, which allows it to move quickly over short distances. Cheetahs are also known for their ability to jump high into the air when they attack prey or escape from danger.",True
1169,"Elijah is a Jewish holiday that celebrates the life of Jesus Christ. It is celebrated on the first day of Passover, which falls on April 15th this year. The holiday commemorates Jesus' death and resurrection, as well as his role in bringing about salvation for all people through faith in God.",True
1170,"J. Edgar Hoover was the first director of the Federal Bureau of Investigation (FBI) from 1924 to 1972. He took his calls in Langley, Virginia at a desk that is now on display at the FBI headquarters building there.",False
1171,"A kangaroo incubates its offspring in a pouch. The female kangaroo has two pouches, one on each side of her body. Each pouch is used to carry and nurse the young at different times during their development.",False
1172,Basil is safe from Hypervitaminosis D. It has a low vitamin content and does not contain any toxins that can cause hypervitaminosis.,True
1173,"Garfield is known for hating Italian cuisine. He has been seen eating pizza, pasta and other foods that are typically associated with Italy. In one strip, he even says ""I hate Italian food"" while holding a plate of spaghetti in his mouth!",False
