,input,answer
1721,"E.T. the Extra-Terrestrial would love Friendly's because it is a restaurant that serves delicious food and has friendly staff members who are always willing to help out their customers in any way they can. The menu at Friendly's includes items such as burgers, fries, shakes, and ice cream sundaes which are all perfect for an alien like E.T., who loves to eat! In addition to the great food options available at this establishment there is also plenty of seating so you don’t have worry about finding somewhere comfortable while dining here either!",True
1722,"Sugar Ray Robinson was a boxer who fought in the 1940s and 1950s. He won world titles in five different weight classes, including lightweight, welterweight, middleweight and heavyweight. In his career he had over 238 fights with an impressive record of winning more than half of them by knockout or technical knockout (TKO).",False
1723,"The TMNT coloring book would have pizza in it. Pizza is a popular food item that can be found in many different types of restaurants, including the ones that sell pizzas.",True
1724,"Crucifixion is a form of capital punishment that involves the execution of an individual by being tied or nailed to a large wooden cross and left to hang until death. The practice was used in ancient times as well as during the Middle Ages, but it has been outlawed in most countries since then. In 1984, however, President Ronald Reagan signed into law an amendment banning cruel and unusual punishments under federal law; this included crucifixion because it causes extreme pain before death occurs due to lack of oxygen supply from hanging upside down for extended periods without food or water intake (which would lead one's body temperature rising).",True
1725,"No, you should not wrap a gift for a mother of a stillborn in stork wrapping paper. The stork is an ancient symbol of fertility and birth, so it would be insensitive to use this image as the wrapping paper for such an occasion. Instead, consider using something more appropriate like flowers or butterflies which are symbols of hope and new life.",False
1726,"Hattori Hanzō was a ninja who lived in the Edo period. He is known for his loyalty to the Tokugawa shogunate and his skill as an assassin. Naruto Uzumaki is a fictional character from the manga series ""Naruto"" by Masashi Kishimoto. He is one of Konoha's most powerful ninjas, with incredible strength and speed that rivals even some of Konoha's strongest warriors such as Gaara or Sasuke Uchiha .",False
1727,"Muhammed was a member of the Uniting Church in Australia. He was born on 15th May, 1980 and died on 2nd June, 2017. His father's name is Abdullah and his mother's name is Aisha. He had two brothers named Ali and Ibrahim who were also members of the Uniting Church in Australia as well as one sister named Fatima who passed away at age six due to an illness called leukemia which she contracted from her brother Muhammad when he gave her some blood during their childhood years together before they moved out into separate homes after graduating high school together with other siblings like Hussain or Hassan (who both went onto become doctors).",False
1728,"Sand cats are a species of cat that is native to the deserts of North Africa and the Middle East. They have long, slender bodies with short legs and large ears. Their fur is usually sandy-colored, but can also be brown or grayish in color. Sand cats are nocturnal animals that spend most of their time hunting for food at nighttime when it's cooler outside than during daylight hours when they would be more vulnerable to predators such as lions or hyenas who might try attacking them if they were seen out during those times instead!",False
1729,"Paul the Apostle was a Christian missionary who traveled to many different countries, including India. He is known for his teachings on love and forgiveness, which are in line with the tenets of Ahimsa. However, it is unclear if his cause of death violated these principles as there are no records or accounts from that time period detailing how he died.",True
1730,"A sophist would use an épée. The word ""sophist"" comes from the Greek word for ""wise man."" Sophists were philosophers who taught rhetoric and logic, which are both important skills in using an épée.",False
1731,"In most Mennonite homes, children would not know of The Powerpuff Girls. This is because the show was created by a man who had been raised in an Amish community and it has many references to that lifestyle.",False
1732,"Freya is a combination of Athena and Aphrodite. She was the goddess of love, beauty, sex and fertility in Norse mythology. Her name means ""beautiful"" or ""fair"".",True
1733,"The answer is yes. You can brew beer from start to finish in the month of September. There are many different types of beers that you can make, and each one has its own unique flavor profile. Some popular styles include IPAs, stouts, porters and lagers.",False
1734,"The imperial foot is a unit of length that was used in the United Kingdom and its colonies from 1593 to 1824. It was equal to about three feet, or approximately one meter. In modern times, it has been replaced by the metric system as the standard unit of measurement for most purposes. However, some countries still use it for certain purposes such as surveying and construction work because they find it more convenient than using meters or kilometers which are much larger units than an imperial foot would be if measured in today's standards (i..e., one meter equals ten centimeters).",True
1735,"Gomer Pyle was a character on the television show The Andy Griffith Show. He was portrayed by Jim Nabors and appeared in 15 episodes from 1964 to 1967. In one episode, he salutes a lieutenant who is not his superior officer but instead someone who has been promoted above him.",True
1736,"The Prime Minister of the United Kingdom has poor job security. He or she is not elected by the people, but rather appointed by a small group of politicians who are members of Parliament. This means that if they do something wrong, they can be removed from office without going through an election process like other political leaders in democratic countries must go through to stay in power for more than one term (two years).",True
1737,"The Jungle Book is a 1967 American animated film produced by Walt Disney Productions. It was the first animated feature-length film to be released in CinemaScope and Stereophonic Sound, as well as being the last Disney animated feature to be distributed through Buena Vista Distribution Company until 2004's Home on the Range.",True
1738,"Ginger is a spice that has been used for centuries to treat nausea and vomiting. It's also known as an anti-inflammatory, which can help reduce inflammation in the body.",True
1739,"The events of Star Trek: The Next Generation are not in the history of the world. In fact, they take place in a parallel universe that is very different from our own. This means that there are many differences between these two universes, including their histories and cultures.",False
1740,"Pig meat is considered inedible within the cuisine of Hawaii. The pigs are raised for their meat and not as a food source. They are also used to make charcuterie, which is a type of cured meat that can be eaten raw or cooked.",False
1741,"Hanging is a viable execution method on a ship at sea. The United States Navy has used hanging as an execution method since the 1800s, and it is still in use today. In addition to being legal, hanging is also considered humane because it does not cause pain or suffering like other methods such as lethal injection or electrocution do.",True
1742,"The Iberian wolf is a subspecies of the gray wolf that lives in Spain and Portugal. It has been hunted for centuries, but it was not until 1976 that hunting became legal again. In 2005, there were only about 30 wolves left in Spain and Portugal combined; however, by 2014 this number had increased to over one thousand animals!",False
1743,"The 1980 United States presidential election was a landslide victory for Republican Ronald Reagan over incumbent Democratic President Jimmy Carter. It was the first time since 1964 that an incumbent president lost re-election, and it marked the end of a period in which Democrats had held the White House for twenty consecutive years.",True
1744,"The word swastika is derived from the Sanskrit word svastika, which means ""good luck"" or ""well-being"". It was used as a symbol of good fortune and prosperity in ancient India. In Hinduism, it is considered to be an auspicious symbol that represents the sun's movement across the sky.",True
1745,"The Toyota Stadium is a football stadium in the city of Gotheburg, Sweden. It has a capacity of 16,000 people and was built in 2013.",False
1746,"The Portuguese Colonial War was a war that took place in the African regions of Angola, Mozambique, and Guinea-Bissau. It began in 1961 and ended with the independence of these three countries from Portugal on April 25th, 1974. All three countries share an official language which is Portuguese but they also have their own native languages as well such as Kikongo (Angola), Kimbundu (Mozambique) or Crioulo/Kiswahili (Guinea Bissau).",True
1747,"The Land of Israel was in possession of an Islamic empire in the 16th century. This empire, known as the Ottoman Empire, ruled over much of Europe and Asia for centuries. The Ottomans were a powerful force during this time period and their influence can still be seen today.",True
1748,"The Liebherr LTM 11200-9.1 is a mobile crane that has a maximum lifting capacity of 3,564 tons and can lift up to 78 feet high. It was first introduced in the year of 2015 and it is currently one of the largest mobile cranes available on the market today.",True
1749,"The Department of Defense can perform a solo. They have performed many solos in the past, including one at the 2016 Olympics.",False
1750,"A bumblebee does not have to worry about spider veins. Spider veins are a common condition that affects the skin and can be caused by many different factors, including genetics, age, sun exposure and pregnancy. There is no cure for spider veins but there are treatments available that may help reduce their appearance or prevent them from getting worse over time.",False
1751,"Queen bees are not necessary for growing apples. They do, however, play an important role in the pollination of apple trees. Without queen bees to help with pollination, it would take much longer for apples to grow and ripen properly.",True
1752,"The Law & Order series is a crime drama that has been on the air since 1990. It follows the lives of police officers, prosecutors and defense attorneys as they investigate crimes in New York City.",False
1753,"Osama bin Laden is a devout Muslim who follows the teachings of Islam. He prays five times a day and fasts during Ramadan, which is an annual observance that lasts for 29 or 30 days. During this time, he does not eat or drink from sunrise to sunset each day.",False
1754,The producer of Easy Rider will become an octogenarian in 2021. He is a man who has been working on the film for over 50 years and he is now in his eighties.,False
1755,"The Treaty of Versailles was settled over blueberry scones. It is a type of pastry that is made with flour, butter, sugar and eggs. They are usually baked in the oven until they are golden brown on top and then served warm or cold with jam or cream cheese spread on them for breakfast or as an afternoon snack food item at home during lunchtime hours when people have time off from work to eat something light before going back into their offices again after having eaten dinner earlier that day before leaving work early due to illness caused by stress levels being too high because there were so many things happening all at once without any warning whatsoever!",False
1756,"Zucchini is a vegetable that has been used for centuries in many different cultures. It is known to be high in potassium, which can help with blood pressure and heart health. The USDA recommends 7 zucchinis per day as part of their daily recommended intake of potassium.",True
1757,"Kola nuts are a type of nut that is found in the African rainforest. They have been used for centuries as a traditional medicine to treat colitis, but there is no scientific evidence to support this claim. In fact, kola nuts may actually worsen symptoms of colitis by causing inflammation and irritation in the digestive tract.",True
1758,"Donald Duck would be allowed into most grocery stores. He is a cartoon character that has been around for over 80 years and is known for his mischievous behavior. In the early days of Disney, Donald was often seen in movies with other characters such as Mickey Mouse and Goofy. Today, he still appears in many films but now also stars in his own series on television called ""Donald's Quack Attack"".",False
1759,"The United States of America does not touch the Indian Ocean. It is located in North America and borders Canada to the north, Mexico to the south, and both oceans on its west coast.",False
1760,"The second row of QWERTY keyboard can spell Abdastartus's kingdom. It is a combination of the letters A, B, D and S that are arranged in a specific order to form the word ""Abdastartus"". This arrangement was created by Christopher Sholes who invented this typewriter in 1867.",True
1761,"Pottery is a type of ceramic that can be used for cooking. It is made from clay and other materials, such as sand or gravel. The potter's wheel was invented in the 18th century to make pots more easily than by hand-building them one at a time on an anvil (a metal plate).",False
1762,"You should ask a neighbor for candy on New Year's Eve. It is the time of year when people are most likely to be generous and share their treats with others. Plus, it is always fun to see what kind of candy your neighbors have in their stash!",False
1763,"Eye surgery on a fly would be in vain. The eyes of flies are not like human eyes, and they do not have the same functions as human eyes. Flies' vision is limited to light and dark, so it is impossible for them to see anything else that might be happening around them during an eye surgery procedure.",True
1764,"Jabberwocky is a poem written by Lewis Carroll in 1872. It was published as part of his book Through the Looking-Glass, and What Alice Found There. The poem has no rhyme scheme or meter, but it does have an ABAB rhyming pattern that can be considered a sonnet form if you consider all four lines to be one line instead of two separate ones (the first two lines are A and B).",False
1765,"White light is the absence of color. It is a combination of all colors, and it has no hue or saturation. The human eye can see white light because it contains all wavelengths in the visible spectrum.",False
1766,"Christopher Walken could enlist in the United States Marine Corps. He is a natural-born citizen of the United States and has no criminal record. However, he would not be able to serve as an officer due to his age (he was born on March 31st).",False
1767,"The Milky Way has at least ten times the number of stars as Earth's population. It is estimated that there are between 100 and 400 billion stars in our galaxy, with an average of about one star per light year. This means that if you were to travel from one end of the Milky Way to another, it would take you around four million years!",True
1768,"The Hobbit is a fantasy novel by J. R. R. Tolkien, first published in 1937 to critical acclaim, being nominated for the Carnegie Medal and awarded a prize from the New York Herald Tribune for best juvenile fiction of 1938.<br>The book was well received by fans and reviewers alike, spawning several adaptations and influencing many other works of fantasy literature.<br><br>The story begins with Bilbo Baggins telling his nephew Frodo about how he came into possession of an ancient ring that had been passed down through generations before him; this ring has magical powers which allow its wearer to travel anywhere they wish without having any physical limitations or obstacles blocking their path (such as mountains).<p style=""font-size:20px"">",True
1769,"Peach blossoms and Andromeda are two different types of flowers that bloom at different times. Peach blossoms typically bloom in the spring, while Andromeda usually blooms in the summer.",False
1770,The Mini was the first car manufactured by British Motor Corporation (BMC). It was introduced in 1959 and became a popular choice for commuters.,False
1771,"Arnold Schwarzenegger is a former professional bodybuilder and actor who has won multiple Mr. Olympia titles, while Hafþór Björnsson is an Icelandic strongman and actor who has also competed in powerlifting competitions. Both men are known for their impressive physical strength, but it's unlikely that they would be able to compete against each other in a powerlifting competition due to the different types of training required for each sport. In bodybuilding, athletes focus on building muscle mass through weight training and nutrition plans; this type of training requires more repetitions with lighter weights than what you would see in powerlifting competitions where lifters attempt one or two heavy lifts per session (usually squats or deadlifts).",False
1772,"Mesopotamia was a region in the Middle East that is now part of Iraq. It was located between the Tigris and Euphrates rivers, which are known as ""the cradle of civilization"" because they were home to some of the earliest human settlements. The area has been inhabited since at least 10,000 BC and it is believed that agriculture began there around 8597 BC when people started growing wheat for food instead of just eating wild grains like barley or millet (which were still being used).",False
1773,"The War Doctor was a Time Lord who fought in the Last Great Time War. He is portrayed by John Hurt and first appeared in the 2013 Christmas special, ""The Day of the Doctor"". His character has been described as being more complex than any other incarnation of The Doctor because he had to make difficult decisions that would affect his future selves.",False
1774,"Paprika is a spice made from dried peppers. It can be made without a dehydrator, but it will take longer to dry the peppers and they may not be as crisp or flavorful.",True
1775,"The pancake is a flat cake made from batter and cooked on a hot surface such as a griddle or frying pan. Pancakes are often sweet and sometimes filled with fruit, chocolate chips, nuts, or other ingredients. They can be served at any time of day but are traditionally eaten in the morning as breakfast foods.",True
1776,"Harry Potter is a fantasy novel series written by J.K Rowling and published between 1997 and 2007. The books have been translated into over seventy languages, making them the best-selling book series in history with more than five hundred million copies sold worldwide as of June 2018.",True
1777,"The Hunger Games is a novel written by Suzanne Collins. It was published in 2008 and has been translated into over 35 languages. The book follows the story of Katniss Everdeen, who lives in District 12 with her mother and father, as she competes against other teens from across Panem to win food for her family.",False
1778,"The Exorcist is a 1973 American horror film directed by William Friedkin, adapted from the novel of the same name by William Peter Blatty. It stars Ellen Burstyn and Linda Blair in her feature film debut. The story follows a young girl who begins to exhibit strange behavior after an exorcism performed on her mother results in mysterious events occurring around their home.",True
1779,"Silicone suits are not difficult to use in judo. They can be used for a variety of purposes, including training and competition. The suit is made from silicone, which is a soft material that does not stretch or tear easily. This makes the suit easy to wear and comfortable for the user.",True
1780,"JAG is a military drama that follows the lives of lawyers in the Navy. The show was created by Donald P. Bellisario and ran for 10 seasons from 1995 to 2005, with a total of 234 episodes produced over those years. In its first season, it averaged around four million viewers per episode; however, this number dropped significantly during later seasons due to competition from other shows on rival networks such as CSI: Miami and NCIS (which also starred Mark Harmon).",True
1781,"In isopropyl alcohol, the solubility of salt is low. The reason for this is that the molecules in water are polar and have a strong attraction to each other. This causes them to form hydrogen bonds with one another, which makes it difficult for non-polar substances like salt to dissolve in water.",True
1782,"The Japanese street aesthetic was once illuminated by noble gasses. In the 19th century, Japan's economy began to grow and its population increased rapidly. This led to an increase in demand for food and other goods, which resulted in more people living on the streets of Tokyo. As a result of this growth, many new businesses were established along these streets including restaurants and shops selling various items such as clothing or electronics etc..",True
1783,"Rich and Morty are a pair of cartoon characters that have been around for over 20 years. They were created by the late comedian, Bill Cosby, who was also an alcoholic. The show is about two friends who live in a small town called ""Richland"" and their adventures together as they try to make sense of life's challenges.",True
1784,"The Gorillaz is a virtual band that was created by Damon Albarn and Jamie Hewlett. They have released five studio albums, one live album, two remix albums and four compilation albums. Their first album was self-titled ""Gorillaz"" which came out in 2001 with the single ""Clint Eastwood"".",True
1785,"Bengal cats are known to be very active and playful, so they need a lot of energy. They also require a high-quality diet that is rich in protein and fat. Pancakes are not the best food for them because they do not contain enough nutrients to keep them healthy.",False
1786,"A person suffering from Thalassophobia does not enjoy oceanography. The fear of the sea is a phobia that can be triggered by many things, including being in or near water, seeing images of water or hearing stories about it. It's also possible to have this phobia without ever having been near an ocean before!",False
1787,"Glycol is a chemical that is used in the production of plastics, paints and other products. It can be found in many household items such as toothpaste, shampoo and detergent. United Airlines does not purchase glycol but it may use it for some purposes such as cleaning aircraft or making paintings on planes more durable by using an adhesive agent called ""glycerin"".",True
1788,"Poseidon is the Greek god of the sea, and Vulcan is a Roman god who was associated with fire. Both gods were known for their strength and power, but they had different domains. Poseidon was responsible for controlling all bodies of water on Earth while Vulcan controlled volcanoes and earthquakes.",False
1789,"The Green Party of England and Wales is a political party in the United Kingdom. It was founded in 1983 by David Chaytor, who had been elected to Parliament as an independent candidate for the constituency of Bury North. In 2005, it became one of three parties that were allowed to stand candidates at general elections without having won any seats previously; this privilege has since been extended to all registered parties with more than two percent support nationwide (as measured by opinion polls).",False
1790,"Depressed people travel to the Golden Gate Bridge often. The bridge is a popular tourist destination and has been featured in many movies and television shows. It is also known for its suicide rate, which has led to increased security measures on the bridge.",True
1791,"Some people soak in olive oil and water. The benefits of this practice are that it can help to reduce the appearance of cellulite, improve skin tone, and promote healthy hair growth. Additionally, some believe that soaking in olive oil can also help to detoxify the body by removing harmful toxins from the skin's surface.",True
1792,"The wandering albatross is a large seabird that can fly for days without rest. It has been known to travel from the coast of Chile to New Zealand, which is over 10,000 miles away.",True
1793,"Durian fruits are an olfactory delight. They have a strong, pungent smell that is often described as being similar to rotten onions or garlic. The fruit itself is large and round with a hard outer shell that can be difficult to open without special tools. Once opened, the flesh of the durian fruit has a creamy texture and sweet taste that many people find enjoyable.",False
1794,"Aerosmith can legally drive in the carpool lane. The band has been known to use their fame and influence to get special treatment, including being able to drive in the carpool lane. In 2015, they were caught driving through a red light while using their celebrity status as an excuse for not getting ticketed by police officers who stopped them on suspicion of drunk driving.",True
1795,"Petroleum jelly is a type of petroleum product that can be used as fuel in cars. It has been found to have an energy density of 10,500 kJ/kg (2,467 MJ/kg), which is higher than gasoline and diesel fuels but lower than ethanol or methanol.",False
1796,"The New York Public Library does not sell Alpo products. However, the library does have a collection of books and other materials that are available for checkout by members of the public.",False
