,input,answer
0,"The Mongol Empire was the largest empire in history, and Genghis Khan is believed to have fathered 16 children. It is estimated that there are more than 20 million people alive today who are descendants of Genghis Khan. Julius Caesar had only one child, a daughter named Julia Augusta Caesaris Octavia Thurina Minor. She died at the age of two and he never remarried or had any other children.",True
1,"The Police were a British rock band formed in London in 1977. They consisted of Sting (vocals, bass), Andy Summers (guitar) and Stewart Copeland (drums). The group released five studio albums, two live albums and several compilations before disbanding in 1986. Their music incorporated elements of new wave, reggae, punk rock and worldbeat.",False
2,"A Monoamine Oxidase candy bar would cheer up a depressed friend. The ingredients in the candy bar are all natural and contain no artificial flavors or colors, making it safe for anyone to eat. It also contains vitamin B12 which helps with energy levels and moods, as well as magnesium which is known to help reduce stress levels in people who suffer from anxiety disorders such as panic attacks or social phobias (Kim et al., 2017).",False
3,"A dog would respond to a bell before a grey seal. Dogs are more likely to be trained than grey seals, and they have better hearing than the latter.",True
4,"The pound sterling is the official currency of the United Kingdom. It is also used in some other countries, such as Gibraltar and Jersey. The pound sterling was first introduced in 1694 by King William III of England and Scotland to replace gold coins that had been minted since 1583 with silver coins instead.",False
5,"Shrimp scampi is a dish that consists of shrimp cooked in butter, garlic and white wine. It is usually served with pasta or rice. The name ""scampi"" comes from the Italian word for lobster, which was used to describe the dish because it resembled lobster in appearance and taste.",False
6,"The anchors on Rede Globo speak Chinese. They are all native speakers of the language and have been trained in China for many years. In addition, they also have a strong understanding of Brazilian culture and history which makes them well-suited to presenting news about their country to an international audience.",False
7,"The Albany in Georgia is expected to reach a hundred thousand occupants before the one in New York. It has been predicted that by 2035, the population of Albany will be over 100,00 people. This prediction was made based on data from previous years and current trends within this city's demographics such as birth rates and immigration patterns which indicate an increase in population growth rate compared with other cities across America during this time period (eighty-five percent).",False
8,"The Boeing 737 is a cost-effective, fuel-efficient aircraft that has been in production since the early 1960s. It was designed to be an affordable and reliable airliner for short haul flights. The plane's design features include a low wing, two engines mounted on pylons underneath the wings and fuselage with no tailplane or horizontal stabilizer (stabilizing surfaces).",True
9,"The language used in Saint Vincent and the Grenadines is rooted in English. It has a number of unique features, including its use of creole words and phrases. These are often derived from French or Spanish, but can also be found in other languages such as Portuguese or Italian.",True
10,"Casio products are available at Petco. They offer a wide range of watches, calculators and other electronic devices that can be used for everyday use or as gifts.",False
11,"The Space Race was a competition between the United States and the Soviet Union to be first in space. It began with Sputnik 1, which was launched by Russia on October 4th, 1957. This event sparked fears of nuclear warfare as it showed that Russia had superior technology over America's military capabilities at this time period (the Cold War). In response to this threat from communism during World War II when Germany invaded Poland in September of that year; President Truman announced his ""Atoms for Peace"" program where he offered atomic energy research facilities worldwide so they could develop their own weapons if needed against any potential aggressors like Nazi Germany or Japan who were both defeated earlier during WWII but still posed threats due their large populations combined with strong militaries capable enough fighting off attacks from other countries such as China whose population exceeded one billion people around then too!",False
12,"Christmas trees are not similar to deciduous trees. They have a different shape and size, as well as their leaves do not fall off in the winter.",True
13,"Biochemistry is the study of chemical processes within and relating to living organisms. It is concerned with the structure, function, chemistry, and pathology of cells. The field encompasses a broad range of specialties including molecular biology; bioinformatics; genetics; cellular physiology (including cell signaling); developmental biology (embryogenesis); pharmacological sciences such as neuropharmacology and psychopharmacolo...",False
14,"The land owners elected their rulers in the Kingdom of Hungary. They were called ""the Estates"" and they had three branches, namely the clergy, nobility and townsmen. Each branch was represented by a member who voted on behalf of all members within that group.",False
15,"Nancy Pelosi has publicly denounced abortion. She is a strong supporter of the pro-choice movement and believes that women should have the right to choose whether or not they want an abortion. In 2018, she was one of only two Democrats in Congress who voted against a bill that would have banned late-term abortions after 20 weeks gestation.",False
16,"Dragon Ball shows and movies fall short of Friday 13th number of projects. The franchise has been around for over 20 years, but it still hasn't reached the same level as other popular anime series like Naruto or One Piece. In fact, there are only two official Dragon Ball films that have ever been released in Japan - one in 1986 and another one last year (2017).",True
17,"The class of 2017 would have amnesia about 9/11. They were born in the year after the attacks, and they are too young to remember them.",True
18,"Greed is the most prevalent of the Seven Deadly Sins. It is a sin that can be found in all people, and it often leads to other sins such as gluttony or sloth. Greed can also lead to violence and destruction, which are two of the other deadly sins.",False
19,"A psychic who admits to hot reading would not be trustworthy. Hot reading is a form of cold-reading that uses information about the person being read to make predictions or give advice. This type of psychic can often be found in fortune telling shops and on television shows, but they are not reliable sources for accurate predictions or guidance.",False
20,"The average number of peas in a pod is enough commas for a billion. There are 10,000, and each one has an average of 25 peas. That means there are about 25 million commas in the world!",True
21,"Leila George is a model and actress who has been in the industry for over 10 years. She was born on October 23, 1987, in Los Angeles, California. Her height is listed as being between five feet eight inches (5'8"") to six feet tall (6').",False
22,"Dustin Hoffman is one of the B'nei Yisrael. He was born in 1937 and has been a member of the tribe since his birth. His father, who was also a member of the tribe, died when he was young and left him with his mother to raise him alone.",True
23,"If you were on a diet, you would have to skip lunch at McDonald's. The food is high in calories and fat, which can lead to weight gain if eaten regularly. Additionally, the restaurant does not offer many healthy options such as salads or vegetables.",False
24,"The Powerpuff Girls could hypothetically attend the Camden Military Academy. They are all very smart and have a lot of potential, so they would be able to handle the rigorous curriculum. Additionally, their superpowers would come in handy during drills and other military-related activities.",False
25,"The top of Mount Fuji would stick out of the Sea of Japan. It is a volcano that has been dormant for over 300 years and it is located in Honshu, Japan.",True
26,"An uninsured person would be more likely than an insured person to decline a CT scan. The reason for this is that the cost of a CT scan can be very high, and many people do not have the money to pay for it out-of-pocket. Additionally, some insurance plans may only cover certain types of scans or may require preauthorization before they will cover them at all.",True
27,"The Donatello crucifix was identified in 2020 as a life-size sculpture. It is believed to have been created between 1435 and 1465, making it one of the oldest known examples of Renaissance art.",False
28,"Disneyland Paris is the largest Disney resort in Europe. It has 5,800 rooms and covers an area of 27 square miles (71 km²). The park opened on April 12th, 1992 with a total cost of $4 billion dollars.",False
29,"The keyboard layout is a standard QWERTY, but the keys are arranged in a different way. This makes it easier for people with fine motor control issues to type on the computer.",True
30,"Adam Sandler would get a reference to Cole Spouse and a scuba man doll. He is known for his comedic roles in movies such as ""The Wedding Singer"" and ""Billy Madison"". In addition, he has been nominated for an Academy Award three times.",True
31,"There is a warthog on Broadway. It's called the Warthog, and it's located at 1025 Broadway in New York City. The Warthog is a bar that serves food and drinks, as well as live music performances by local bands.",True
32,"Disney has an ice princess. She is a beautiful, kind-hearted young woman who lives in the kingdom of Arendelle with her parents and sisters. Her name is Elsa and she was born with magical powers that allow her to create snow and ice at will.",True
33,"A geographer would not use biochemistry in their work. Geographers study the physical features of Earth, such as mountains and rivers, and how they affect human activity. They also study the distribution of people on Earth's surface and how it changes over time. Biochemists are scientists who study living organisms at a molecular level to understand their structure, functioning mechanisms within cells or tissues that make up an organism (eukaryotes).",False
34,"George Washington's speeches could have been recorded live to a compact disc. The first known recording of his voice was made in 1859 by Thomas Edison, who used the phonograph to record him speaking into a tin cup.",False
35,"Lil Jon's top ranked Billboard song was a collaboration with a member of The Lox. It was titled ""Get Low"" and it featured the rapper Ying Yang Twins.",False
36,"Black salt is a type of rock salt that has been treated with iron and sulfur. It is used in Indian cuisine to add flavor to foods such as curries, pickles, and chutneys. The smell of black salt can vary depending on the brand or variety you purchase but it typically has a strong sulfurous odor that some people find unpleasant.",True
37,The Spirit broadcast would make the news in 2020. It is a very interesting story and it has been covered by many different media outlets.,True
38,"Miami is a city on the American West Coast. It is located in Florida and has a population of over 40 million people. The city was founded by Spanish explorers in 1562, making it one of the oldest cities in America.",False
39,"Robert Wadlow could hypothetically see Frankenstein's monster's bald spot from above. The height of the tallest man in history, Robert Wadlow, was 8 feet and 11 inches (272 cm). This is taller than the average human male who stands at about 5 feet and 9 inches (175 cm) tall.",True
40,"The tibia is a bone in the lower leg that runs from the knee to ankle. It is necessary for winning the Stanley Cup because it helps players move their legs and feet quickly, which allows them to skate faster and make better passes.",True
41,"An ethics professor would not teach a class on Cezanne. The subject matter of an ethics class is the study of moral philosophy, which includes topics such as morality and justice. A course in art history or painting techniques might be more appropriate for someone interested in learning about Cezanne's work.",False
42,"Horchata is a traditional Mexican drink made from rice, cinnamon and sugar. It can be served hot or cold and is often used as an ingredient in other dishes such as desserts.",False
43,"The Swiss Guard is a military force that protects the Pope. They are not allowed to leave their post, and they cannot be replaced by anyone else.",False
44,"If your skin was turning the color of a zombie, it could be because of nickel. Nickel is a metal that can cause allergic reactions in some people. It's also used to make jewelry and other items that come into contact with your skin.",True
45,"A Dolce & Gabbana suit wearer would be shunned by their Amish cousins. The Amish are a religious group that believes in simplicity and modesty, while Dolce & Gabbana is known for its luxurious and extravagant designs. Wearing a Dolce & Gabbana suit to an Amish community would likely cause offense and discomfort among the members of the community.",True
46,"The Illuminati card game is still popular. It has been around for over 20 years and continues to be played by people all over the world. There are many different versions of the game, but they all share one common goal: to take down the Illuminati!",False
47,"Strawberries are a type of fruit that is grown in the United States. They have been known to be infested with worms, which can cause serious health problems for dogs. The best way to prevent this from happening is by keeping your dog away from strawberry plants and making sure they do not eat any berries that may fall off the plant or onto their fur while playing outside.",True
48,"Menthol is associated with Thanksgiving because it is a holiday that celebrates the harvest of the year. The word ""menthol"" comes from Latin and means ""to be thankful.""",False
49,"Solanum melongena is a vegetable that is commonly referred to as an eggplant in Mumbai. It has a dark purple skin and white flesh, with the shape of an oval or ellipse. The plant grows up to 10 feet tall and produces large fruits that are about 2 inches long by 1 inch wide.",False
50,"It is not okay to lie after taking an oath in a court of law. The reason for this is that the person who takes an oath has sworn to tell the truth and nothing but the truth, so if they do lie then they are breaking their own promise. This can lead to serious consequences such as being found guilty or even going to jail.",False
51,"Art is not prioritized in the US education system. In fact, it is often seen as a luxury and something that can be cut from school budgets when times are tough. This viewpoint has led to many schools cutting art programs or making them optional for students who want to take them on their own time instead of during class hours.",False
52,"While on a liquid diet, there are some types of soup you cannot eat. For example, if you have an allergy to dairy products or soybeans then it is best to avoid eating any type of milk-based soups such as chicken noodle soup or tomato bisque. If your doctor has recommended that you follow this type of diet for medical reasons then they will likely provide specific instructions about what foods should be avoided while following the plan and which ones can be consumed safely without causing harmful side effects like nausea and vomiting after consuming them too quickly without proper preparation time beforehand (such as boiling water).",True
53,"It would be impossible to use an Iwato scale for a twelve-tone technique composition. The Iwato scale is a Japanese musical system that uses the notes of the pentatonic scale, but with different intervals between each note. This means that it does not have all of the necessary notes needed for a twelve-tone technique composition, which requires all 12 chromatic tones in order to create harmony and melody.",True
54,"The Titanic would be well preserved at the bottom of the Gulf of Finland. It is a large body of water that has a depth range from 10 to 25 meters, which means it can hold objects up to about 30 feet deep. This makes it an ideal place for preserving artifacts like shipwrecks or other underwater structures because they will not be disturbed by currents or waves as they are in shallower waters where there is more movement and turbulence due to winds and tides changing direction frequently throughout each day/night cycle (which also affect how much light reaches these areas).",True
55,"A dandelion is a plant that has yellow flowers and grows in the wild. It can be found all over the world, but it is most common in North America. The flower of a dandelion looks like an upside-down umbrella with small white petals around its center. Dandelions are often used as food or medicine because they contain many nutrients such as vitamins C and E, potassium, iron and calcium; however some people believe that eating too much of them could cause liver damage due to their high levels of oxalic acid which may lead to hepatitis if consumed regularly over time (although this hasn't been proven).",False
56,"The Portuguese Colonial War was a war between Portugal and the African countries of Angola, Mozambique, Guinea-Bissau and Cape Verde. It began in 1961 with an uprising by the FRELIMO (Mozambican Liberation Front) against Portuguese rule in Mozambique. In 1974, after years of fighting on both sides that resulted in thousands killed or wounded on each side as well as millions displaced from their homes due to bombings by airplanes flown over land mines planted underground during battles fought at night when it was too dark for pilots to see what they were doing while flying low enough so that they could avoid being shot down if enemy forces had guns pointed at them from below ground level where there would be no way for them know whether or not someone else might have been shooting back until after landing safely somewhere safe away from danger again later on another day when things wer't quite so bad anymore but still pretty dangerous nonetheless because even though everyone knows how important safety is these days nobody wants anything bad happening ever again either which means we all need protection now more than ever before!",True
57,"A week would be enough time to watch every episode of Ugly Betty. The show is a comedy-drama that follows the life of an average woman who works as a fashion assistant at Mode magazine in New York City. She has been working there for 10 years and she's still not sure if she wants to stay or leave her job, but one thing is certain - this show will make you laugh out loud!",True
58,"The Picts were a group of people who lived in the north of Scotland and northern England. They spoke an ancient language called Old English, which is now extinct.",True
59,"The Louisiana Purchase was made with bitcoin. It is a digital currency that can be used to buy goods and services, or traded for other currencies. Bitcoins are created through a process called mining, which involves solving complex mathematical problems using computer hardware.",False
60,"The Japanese serfdom was a system of land tenure that existed in Japan from the 12th century to the Meiji Restoration. It was based on feudalism and involved peasants who were bound to their lords by various forms of obligation, including military service, labor services or taxes. In England during this time period there were also systems similar to serfdom but they did not have as much power over people's lives as those found in Japan at this time period because they had more rights than what would be considered normal today such as being able access education without paying any tuition fees which is something we take for granted nowadays but wasn't always available back then due mainly because it wasn’t seen necessary until recently when society started changing drastically after World War II ended so now everyone has equal opportunity regardless if you come from an upper class family or not!",True
61,"The best tasting part of the papaya is in the center. It has a sweet, juicy flavor that can be enjoyed by everyone.",False
62,"The Chevrolet Corvette ZR1 is a high-performance sports car that was first introduced in 2009. It has a top speed of over 205 mph and can accelerate from zero to sixty miles per hour in under four seconds. The ZR1 comes with an eight-speed automatic transmission, which allows for quick shifting between gears when needed.",False
63,"The phrase ""double duty"" is not an incorrect phrase for host of Dancing With The Stars. It means that the person has two jobs, one as a host and another as a dancer. This can be seen in the show's title, which reads ""Dancing with the Stars.""",False
64,"Lil Wayne was born in New Orleans, Louisiana on September 27th, 1982. He began his career as a rapper at the age of nine and released his first album ""Tha Block Is Hot"" when he was only thirteen years old. In addition to being an accomplished musician, Lil Wayne is also known for being one of the most successful rappers in history with over $50 million dollars earned from record sales alone since he started releasing albums back in 1996!",False
65,"An ocelot could subsist on a single bee hummingbird per day. The ocelot is an omnivore that eats small mammals, birds, reptiles and amphibians. It also consumes insects such as grasshoppers and crickets which are found in abundance during the summer months when they migrate to their breeding grounds from Mexico or Central America where they spend most of their time feeding on nectar from flowers like honeysuckle vines or milkweed plants with large leaves that provide shelter for these tiny creatures while providing them with food sources like pollen grains which contain protein needed by both adults and young ones alike!",False
66,"The Ukrainian Greek Catholic Church does not recognize Alexander Nevsky as a saint. However, the Russian Orthodox Church and the Roman Catholic Church do recognize him as a saint.",False
67,"The original James Bond actor was born near the Washington Monument. He was a British spy who worked for MI6 and fought against Nazi Germany during World War II. His name is Ian Fleming, and he wrote many books about his adventures as an agent of Her Majesty's Secret Service (HMS).",False
68,"J. P. Morgan had healthy lungs and was a very wealthy man who lived in New York City, USA during the 19th century. He was born on April 17, 1837 and died on March 25, 1904 at age of sixty-six years old due to pneumonia complications from tuberculosis which he contracted while working as an investment banker for his father's company called ""Morgan & Company"".",False
69,"Firefighters were included in the September 11th memorial. The names of all firefighters who died on September 11th are listed on a wall at the World Trade Center site, and there is also a separate memorial for them.",True
70,"Andrew Johnson's presidential number is 17, which exceeds Elagabalus's Emperor number of 21.",False
71,"The Chinese calendar is a lunisolar calendar that has been used in China for over 3,000 years. It is based on the cycles of the moon and sun, with each year divided into twelve months of thirty days each. Each month begins on a new day according to its position relative to Earth's orbit around Sun (the ""solar"" part), but also includes an extra five-day period at midyear when there are no full moons (the ""lunar"" part). This means that every year contains exactly 12 full moons instead of just one like Western calendars do; this makes it easier for people living far away from their home country or continent because they can still keep track easily without having any special knowledge about astronomy or mathematics!",True
72,"A hypothetical Yeti would be towered over by Andre the Giant. The Yeti is a mythological creature that has been described as being 10 feet tall and weighing up to 3,000 pounds. Andre the Giant was a professional wrestler who stood at 7 feet,4 inches tall and weighed in at around 525 pounds.",True
73,"The crucifix is a symbol of Christianity and it is not likely to find one in Karachi. However, there are many other symbols that can be found in the city such as the crescent moon and star which represent Islam.",False
74,"The Little Prince's titular character was allergic to flowers. He had a severe allergy that caused him to sneeze violently and cough uncontrollably when he came into contact with them. This made it difficult for him to enjoy the beauty of nature, as he could not go outside without risking an attack from his allergies.",False
75,"The Birth of Venus is a painting by the Italian Renaissance artist Sandro Botticelli. It was painted in 1483 and depicts the goddess Venus arriving at Cyprus, where she will be born. The painting has been reproduced many times over its history, including on postcards and other souvenirs sold to tourists visiting Italy's Uffizi Gallery since 1907 when it was first displayed there as part of an exhibition celebrating Florence's artistic heritage during World War I (the war had caused severe damage to much of Europe).",True
76,"Millard Fillmore was a member of the Whig Party and served as President from 1850 to 1853. He helped establish the University of Pittsburgh in 1946, which is now known as Carnegie Mellon University.",False
