,input,answer
544,"A rock will float in the atmosphere of Earth. The density of a rock is less than that of air, so it will float on top. However, if you put a large enough amount into the atmosphere at once then it may sink to the ground due to its weight and gravity pulling downward on them all together as one mass instead individually like before when they were floating separately from each other above us here below where we live now today!",False
545,A newborn could look over the top of a fully grown horseradish plant. The leaves are about 12 inches tall and the stems are about 3 feet long.,False
546,"The Red Sea is a body of water that separates Africa from Asia. It has been the site of many battles and wars throughout history, including the Battle of Actium in 31 BCE, which was fought between Octavian (later known as Augustus) and Mark Antony.",True
547,"Moon cakes are a traditional Chinese pastry that is eaten during the Mid-Autumn Festival. They are round and have a thin crust with sweet fillings such as lotus seed paste, red bean paste or mung bean paste. The moon cake has been around for centuries but it was not until 1950 when they were first mass produced in China by bakeries like Tianjin Moon Cake Factory Co., Ltd..",True
548,"Bugs Bunny is known for carrying a root vegetable around with him. He has been seen carrying carrots, potatoes, and turnips in various cartoons. In one episode of the Looney Tunes series called ""The Wabbit Who Came to Supper,"" Bugs Bunny is shown eating an entire turnip while he sits on top of a mountain peak watching over his home below him; this scene was later reused as part of another episode where Elmer Fudd tries to catch up with Bugs by climbing onto Mount Everest but fails because there isn't enough food left for both men!",True
549,"Yes, someone who buys crickets is likely to own pets. Crickets are a popular pet food and they can be kept in small cages or aquariums. They are also relatively easy to care for and do not require much space or attention.",True
550,"The Catholic Church has a long history in China, dating back to the 16th century. However, there have been periods of tension and conflict between the church and some adherents to Christianity in China. One such period was during the Boxer Rebellion of 1899-1900, when anti-foreign sentiment led to attacks on foreigners and their property throughout northern China. During this time many Catholics were killed or forced into exile by Chinese authorities who viewed them as enemies of their country due largely because they refused loyalty oaths that would require them renounce allegiance from Rome (the Pope).",True
551,"The Kia Rio is a small car that can fit inside the Oval Office. It has a length of 164 inches, width of 70 inches and height of 58 inches. The interior dimensions are also quite small with an overall height being just over six feet tall when standing up straight in front seat positioning it as one foot shorter than most people's average height at five feet nine or ten (depending on gender).",True
552,"The Soviet Union did not offer free education to veterans of the War in Vietnam (1945–46). However, they were given a 20% discount on tuition fees.",False
553,"The Easter Bunny is a popular figure in the United States, and he is often seen as a symbol of springtime. He has been around for centuries, and his popularity continues to grow. In September, the Easter Bunny will be making an appearance at many events across America.",False
554,"Rhinoceroses have been killed to improve human sex lives. The rhinoceros horn is used in traditional Chinese medicine and has been known to be a cure for impotence, gout, and other diseases. In 2015 alone there were over 30 rhinos killed by poachers who wanted their horns for this purpose.",True
555,"Mozambique Drill is a simple shot for the United States Army Ranger. It requires only one hand and can be done with either a pistol or rifle. The drill consists of three shots, each fired in succession from the hip at targets placed 10 yards away from you.",True
556,"Lunch on the beach is a good activity to spot the full circle of a rainbow. The sun's rays are refracted through water droplets in the air, creating an arc that appears as if it were made from glass. This phenomenon can be seen at any time during daylight hours, but is most common when there are clouds overhead or when it rains heavily enough for large amounts of water vapor to form into small droplets high up in Earth's atmosphere (known as ""cloud cover"").",False
557,"ABBA is a Swedish pop group that was formed in 1972. The band consisted of two women and two men, which is similar to the gender configuration of The Mamas & Papas. Both bands were known for their catchy melodies and harmonies, as well as their ability to create memorable songs that have stood the test of time.",True
558,"The Mona Lisa is a painting of the Italian Renaissance artist Leonardo da Vinci. It was painted between 1503 and 1506, and it depicts a woman who has been identified as Lisa Gherardini del Giocondo. She was married to Francesco del Giocondo, an affluent Florentine silk merchant.",True
559,"Bach left his first wife for his second wife. He was married to Anna Magdalena Wilcke in 1721 and they had eight children together. In 1749, he married Anna Maria Barbara Schnabel and they had two children together before she died in 1750.",False
560,"The world's largest cheeseburger is a 1,024-pound burger that was created by the restaurant ""The Big Texan"" in Amarillo, Texas. It took two people to carry it and they had to eat it within an hour or else pay for the entire thing.",False
561,"Justin Timberlake has written a song about Britney Spears. The song is called ""Cry Me A River"" and it was released in 2003. It reached number one on the Billboard Hot 100 chart and won two Grammy Awards, including Best Male Pop Vocal Performance for Timberlake himself.",True
562,"The average salary for a high school head coach is $50,000 per year. This number can vary depending on the size of the school and how much money they have to spend on their athletic program. In North Carolina, there are over 125 public schools that offer football as an interscholastic sport at some level (high school or middle). These schools employ more than 367 full-time assistant coaches who earn an average annual wage of $48k-$69k according to data from Indeed Salaries & Reviews website in July 2018 when this article was written by me!",False
563,"Christopher Columbus was a man of many talents. He was an explorer, navigator, and even a writer. But one thing he wasn't is a Christian. In fact, he didn't believe in the Bible at all! This might come as a surprise to some people because Columbus has been credited with discovering America for centuries now (and rightfully so). However it turns out that there are actually two different versions of this story - one where Columbus does break the fifth commandment in Christianity by killing indigenous peoples on his voyages across oceans; another where he doesn't do anything wrong according to biblical law but still ends up being blamed anyway due solely because Europeans thought they were superior beings who deserved everything good life had given them without question or consequence whatsoever regardless if anyone else suffered from their actions or not.""",True
564,"Yes, you can transport a primate in a backpack. The most common way to do this is by using an animal carrier that has straps and handles on the sides so that it can be easily carried around. You will also need some type of harness or leash for your pet so they don't escape while being transported in their new home!",True
565,"King Arthur was not at the beheading of Anne Boleyn. He was in France with his wife, Queen Guinevere, and their son.",False
566,"The city of Miami is located in the state of Florida, which is a part of the United States. Uppsala, on the other hand, is a city in Sweden that has an area size of 109 square kilometers and a population density around 25 people per square kilometer.",False
567,"The iPhone has more iterations than the Samsung Galaxy. The first iteration of the iPhone was released in 2007, while the first iteration of the Samsung Galaxy was released in 2013.",False
568,"Hanuman is a Hindu god who is associated with the Norse god Thor. He was born to Anjana and Kesari, two monkeys that were sent by Lord Shiva to help him defeat the demon king Ravana. Hanuman's name means ""one who has a long tail"" in Sanskrit and he has been depicted as having an extremely long tail which can be used for various purposes such as swinging from trees or fighting enemies on horseback during battle scenes in Indian mythology paintings .",False
569,"The Polish poet, Adam Mickiewicz, wrote sonnets about Islamic religion. He was a member of the Romantic movement and his work is considered to be some of the most important in Polish literature. His poems are often compared to those written by William Shakespeare and John Milton.",True
570,"Bugs Bunny is a character in the Looney Tunes cartoon series. He was created by Friz Freleng and first appeared in 1940's ""A Wild Hare"". The character has been voiced by Mel Blanc since his debut, and he has become one of the most recognizable characters from American animation.",False
571,"The modern Brazilian Navy could have hypothetically turned the tide in the Battle of Actium. This is because they would have had access to more advanced technology and weapons, which would give them a significant advantage over their opponents. Additionally, they would also be able to use their superior numbers and tactical skills to outmaneuver their enemies on land or at sea.",True
572,"The children of Greek hero Jason hypothetically could fill a polo team. They would be able to play the game well, as they are all skilled in combat and have been trained by their father since childhood. Additionally, they are all strong swimmers and can easily navigate the waterways that surround Greece.",True
573,"The answer is yes, you can swim to Miami from New York. It takes about 10 hours and the distance is around 250 miles. There are a few things to keep in mind when making this journey though, such as the weather conditions and currents that may be present in the ocean at any given time. Additionally, it's important to have a good understanding of how far away your destination is so that you don't get lost or run out of energy before reaching land again!",False
574,"ABBA could play a mixed doubles tennis game against each other. The band members are all very good at playing the sport and have been known to compete in tournaments together. In fact, they even won the Swedish Open Mixed Doubles Championship in 1974!",True
575,"The material from an aloe plant is sometimes enclosed in petroleum-derived products. This can be a problem because the aloe plant is not native to North America and it has been found that the use of these products can cause skin irritation, as well as other health problems.",True
576,"Hurricane Harvey could catch a Peregrine falcon. The hurricane is strong enough to carry the bird away and drop it in another location, but not strong enough to kill it.",False
577,The body of a person who is hanged does not move during the process. This is because the weight of their body pulls them down and they are unable to lift themselves up.,True
578,The author of Little Women would have remembered the ratification of the 13th Amendment. It was a major event in American history and it is likely that she would have been aware of it.,True
579,"Benito Mussolini would hypothetically play well in the NBA. He is a tall, strong man with good reflexes and quick thinking. His height allows him to see over other players on the court, which gives him an advantage when it comes to making shots or blocking opponents' shots from behind their backs or under their arms (which are often used by taller players).",False
580,"The US brand Nice depends on Western honey bee. It is a type of honey that is produced by the Western Honey Bee, which has been used for centuries to make food and drinks.",True
581,"Hulk's alter ego can explain atomic events. He is a superhero who has the ability to control his own body and mind, as well as other people's bodies and minds. His powers include telepathy, telekinesis, invisibility, flight (with or without wings), superhuman strength (up to 10 tons), invulnerability against most forms of physical damage except for fire-based attacks such as flamethrowers or laser beams; he also possesses an enhanced sense of smell that allows him to detect danger from afar before it happens!",True
582,"A firewall is a device that protects against short circuits. It can be used to prevent the spread of fire and smoke, as well as to reduce the risk of electrical shock. Firewalls are typically installed in homes and businesses, but they can also be found in public places such as schools or hospitals.",False
583,"The Swiss Guard is a military force that protects the Pope. They are trained in combat and have been known to defeat other armies, including the Marines.",False
584,Blaire White is a conservative who has been known to repulse people. She is also an advocate for the LGBTQ community and has spoken out against homophobia in her own life.,False
585,"Skeletons do not have hair. The skeleton is the internal structure of an organism, and it does not contain any tissue or organs.",False
586,"The War of the Worlds is a science fiction novel by H.G. Wells, first published in 1898. It tells the story of an invasion of England by aliens from Mars who are able to destroy all human resistance with their advanced technology and weapons, including cosmic rays that can kill humans instantly when they come into contact with them or even through walls if they are strong enough (which would be possible given how powerful these rays were).",False
587,"The Pledge of Allegiance is a patriotic oath that was written by Francis Bellamy in 1892. It has been recited by millions of Americans since then, and it remains one of the most popular pledges in the world today.",True
588,"50 Cent and Jeffrey Atkins have been friends since they were teenagers. They met in the early 1990s when they both attended a high school in Queens, New York. The two became close friends and often hung out together after school. In an interview with XXL magazine, 50 Cent said that he was ""the only person who could get away with calling [Jeffrey] 'Fat Joe'.""",False
589,"It is normal for people to sing when the YMCA is mentioned. The song was written by a man named Danny Kaye and it has been sung by many different artists over the years. The lyrics are about how much fun you can have at a YMCA, and they're also about how important it is to be healthy and active in your life.",True
590,"No, NFL players do not receive infantry training. However, they are required to complete a physical fitness test that includes running and swimming. The tests are designed to ensure that the players can perform at their best during games and practices.",False
591,"The Quran is the holy book of Islam, and it is considered to be one of the most important religious texts in the world. It was written by Muhammad, who was a prophet and founder of Islam. The Quran contains 114 chapters (suras), each with its own unique message or story about God's creation and how humans should live their lives according to His teachings.",False
592,"The Gulf of Mexico is a large body of water that covers an area of 615,000 square miles. It is located between the United States and Mexico and has many islands in it. There are also many ports along its coastline where cruise ships can dock for passengers to disembark or board their ship again after visiting other destinations on land such as New Orleans or Key West Florida .",False
593,"Billie Eilish is a singer and songwriter who has been making music since she was 14 years old. She has released two albums, ""When We All Fall Asleep, Where Do We Go?"" and ""Don't Smile at Me."" Her latest album is called ""Bad Guy"" which came out in May of this year.",True
594,"Secretariat was a champion racehorse that won the Triple Crown in 1973. He also won the Belmont Stakes, which is considered to be one of his most impressive victories. In addition to winning races, he also had an incredible personality and was known for being very friendly with people who came into contact with him during his career as a racehorse.",False
595,"Robert Downey Jr's Marvel Cinematic Universe character survives the Infinity War. He is one of the few characters who does not die in this movie, and he has a lot of screen time.",False
596,"The James Webb Space Telescope is a space telescope that was launched in 2019. It has been used to study the universe and find new planets, including Krypton. However, it does not fail astronomers in locating planet Krypton because they can use other methods such as spectroscopy or photometry to locate it.",True
597,"All crustaceans live in the ocean. They are a type of arthropod that has an exoskeleton and is covered with a hard shell. The most common types of crustaceans include crabs, lobsters, shrimp and barnacles.",False
598,"Children send their Christmas letters to the South Pole. The children write a letter to Santa Claus and ask him for presents, but they do not know where he lives. They also write a letter to the North Pole, which is where Santa Claus lives.",False
599,The population of the Warsaw Ghetto recorded secret police on cell phones. They were able to do this by using a special app that was developed by a group of Polish hackers. This app allowed them to record conversations and take pictures without the other person knowing.,False
600,"John Lennon was known to be a good friend to Sasha Obama. He would often visit her at the White House and they would play together in the garden. They also shared many meals together, including pizza and ice cream sundaes.",False
601,"Spiders can help eggplant farmers control parasites. They are a natural predator of the pests that attack eggplants, and they can be used to keep them under control without using chemicals or other harmful substances.",True
602,"Darth Vader's character resembles Severus Snape in that they are both villains who have a tragic backstory. They also share similarities in their appearance, as both characters wear black robes and masks to conceal their identity. Additionally, they are both skilled at manipulating others and using dark magic for evil purposes. Finally, like Severus Snape, Darth Vader is ultimately redeemed by his son Luke Skywalker after he turns away from the dark side of the Force.",False
603,"A carrot can receive an organ transplant. The most common type of organ transplants are kidney, liver, heart and lung. However, a carrot can also receive a pancreas or intestine from another person who has died in order to help them live longer lives with better health conditions than they had before the surgery took place on their body parts that were donated by someone else who was willing to give up one part of themselves so that another person could have it instead!",False
604,"People with DID have a good memory. They can remember things that happened to them in the past, and they can also remember things that happened to them in the present.",False
605,"The Four Horsemen of the Apocalypse are a group of four beings in Christian mythology. They are described as riding on white, red, black and pale horses. In Revelation 6:1-8 they appear to bring about the end times by bringing war, famine and death to Earth.",True
606,"The iPhone was released in 2007 and it has been a game-changer for the scientific community. It is now possible to take pictures of cells, record videos of experiments, and even perform calculations on the go. This has led to an explosion in research that would have been impossible without this technology.",False
607,"San Francisco is a city that has many natural attractions. The Golden Gate Bridge, Alcatraz Island and the Presidio are all within walking distance of downtown. There are also plenty of hiking trails in the area, including Mount Tamalpais State Park and Muir Woods National Monument.",False
608,"Parsley is a herb that has been used for centuries in cooking and medicine. It is also known as the ""king of herbs"" because it contains many nutrients, including vitamins A and C, folate, iron, calcium and potassium. The leaves are green with white veins running through them; they have a strong flavor that can be bitter or sweet depending on how they're prepared (either raw or cooked).",False
609,"The 1912 election was a close race between the Republican candidate, William Howard Taft, and the Democratic candidate, Woodrow Wilson. In this election there were three other candidates that ran for president including Teddy Roosevelt who had been President from 1904-08.",False
610,"Amoebas are a type of single-celled organism that can be found in soil, water and the human body. They have been known to cause disease in humans, but it is not clear if they played a role in the Black Death. Some scientists believe that amoebas may have contributed to the spread of bubonic plague by infecting rats with fleas which then carried them into people's homes where they would die from exposure or starvation due their lack of food sources such as grain crops being destroyed by pests like locusts during this time period (1347).",True
611,"P. G. Wodehouse was born in 1881 and died in 1975, so he did not have access to the internet as a child. However, he did enjoy reading books and newspapers during his youthful years which helped him develop his writing skills later on in life when he became an author of novels such as ""The Code of the Woosters"" (published by Methuen & Co., Ltd.) or short stories like ""Jeeves Takes Charge"".",False
612,"The Invisible Man is more prevalent in films than Picnic at Hanging Rock. It has been used as a plot device in many movies, including the 1933 film of the same name and its sequel, The Invisible Woman (1940).",True
613,"ABBA's 1970's genre is still relevant today. The band has been around for over 40 years and their music is still popular with people of all ages. Their songs are often used in movies, TV shows, and commercials.",True
614,"Cactus fruit is an important menu item for a restaurant based on Cuauhtémoc. The cactus fruit is served with a side of rice and beans, which are the most popular dishes in Mexico. It's also known as ""cucumber"" because it has many seeds inside that look like small cucumbers when they're cut open.",True
615,"Rumi spent his time in a state of euphoria. He was known for his ecstatic poetry and mystical teachings, which were influenced by the Sufi tradition. His poems often spoke of love, spirituality and divine union with God.",True
616,"Silicon is a very important element in California. It is used to make silicone, which can be found in many products such as computers and cell phones. Silicon also helps with the production of solar panels and wind turbines, both of which are important for reducing greenhouse gas emissions from power plants that use fossil fuels like coal or natural gas instead of renewable energy sources like sunlight or wind power .",True
617,"Lord Voldemort would have been barred from Hogwarts under his own rules. He was a student at the school, but he was expelled for being too dangerous to be around other students.",True
618,A modern central processing unit circuit chip would not fit on a housekey. The size of the chip is too large and it would be impossible to make it small enough to fit on a key.,False
619,"Pancakes are a bad snack for cats. They can cause stomach upset and diarrhea, as well as weight gain. Cats should only eat small amounts of pancakes occasionally, if at all.",True
620,"Maroon 5 did not go on tour with Nirvana. The band was formed in Los Angeles, California in 1994 by Adam Levine (lead vocals), Jesse Carmichael (guitar), Mickey Madden (bass guitar) and Ryan Dusick (drums). In September of that year, the group released their debut album Songs About Jane which featured the singles ""Harder to Breathe"" and ""This Love"".",False
621,"All students are guaranteed lunch at school in the US. The National School Lunch Program (NSLP) is a federally assisted meal program operating in public and nonprofit private schools and residential child care institutions. It provides nutritionally balanced, low-cost or free lunches to children each school day.",False
622,"Methane is a colorless, odorless gas that can be seen by the naked eye. It has a boiling point of -162 degrees Celsius and an explosive limit of 5% in air.",False
